{
  "id": "hc-4070tis-gptoss-20b-mxfp4-16k-pp",
  "type": "benchmark",
  "name": "RTX 4070 Ti SUPER llama.cpp: gpt-oss 20B MXFP4 prefill at 16k ctx (Hardware Corner)",
  "engine_id": "llama-cpp",
  "accelerator_ids": [
    "nvidia-rtx-4070-ti-super"
  ],
  "interconnect_ids": [
    "pcie-gen4"
  ],
  "model": "gpt-oss 20B",
  "format_id": "mxfp4",
  "metric": "prefill_tok_s",
  "value": 4182.7,
  "unit": "tok/s prompt processing, batch 1, per-request, ctx 16k",
  "methodology": "Hardware Corner per-GPU context-tier table (March 2026 update), single RTX 4070 Ti SUPER, llama.cpp GGUF, batch-1 per-request. gpt-oss 20B MXFP4, context depth 16k. Prefill column is prompt-processing tok/s; generation column is decode tok/s. NOT an aggregate across concurrent requests. The page does not reprint the llama-bench build hash (the site's sibling ranking page pins CUDA 12.8 / Q4_K_XL).",
  "measured_by": "third_party",
  "reproducible": true,
  "energy_basis": null,
  "power_w": null,
  "power_scope": null,
  "power_cap": null,
  "clock_lock_mhz": null,
  "thermal_state": null,
  "notes": "Paired generation cell already exists as a decode record at this context, not duplicated. Context is the tier the page groups into, not a llama-bench -d argument.",
  "status": "verified",
  "confidence": 0.6,
  "updated": "2026-10-16",
  "sources": [
    "hardware-corner-gpu-llm-bench-rtx-4070-ti-super"
  ]
}
