{
  "id": "hwc26-rtx-4060-ti-16gb-qwen3-14b-q4k-tg-4k",
  "type": "benchmark",
  "name": "Hardware Corner Mar-2026: nvidia-rtx-4060-ti llama.cpp Qwen3 14B Q4_K GGUF token generation 27.4 tok/s at 4k context",
  "engine_id": "llama-cpp",
  "accelerator_ids": [
    "nvidia-rtx-4060-ti"
  ],
  "interconnect_ids": [
    "pcie-gen4"
  ],
  "model": "Qwen3 14B Q4_K GGUF",
  "format_id": "gguf-q4-k-m",
  "metric": "decode_tok_s",
  "value": 27.4,
  "unit": "tok/s per-request decode (batch 1, ~4096-token context tier)",
  "methodology": "THIRD-PARTY MEASURED (hardware-corner.net /gpu-llm-benchmarks/rtx-4060-ti-16gb/, page updated March 2026, accessed 2026-10-16). llama.cpp llama-bench, GGUF, single GPU, full offload. The page publishes prompt-processing tok/s and token-generation tok/s by context tier; it does not state the llama.cpp build, the prompt length, the generation length, or whether flash attention was enabled. Value is the 4k context column. Per-request batch-1, NOT aggregate across concurrent requests.",
  "measured_by": "third_party",
  "reproducible": true,
  "energy_basis": null,
  "power_w": null,
  "power_scope": null,
  "power_cap": null,
  "clock_lock_mhz": null,
  "thermal_state": null,
  "notes": "Context tier is the page bucket, not an exact measured token count. Page quant Q4_K maps to gguf-q4-k-m; page MXFP4 maps to gguf-mxfp4-moe. Distinct from the older Q4_K_XL 16k-decode rows sourced from hardware-corner-gpu-ranking-local-llm.",
  "status": "verified",
  "confidence": 0.6,
  "updated": "2026-10-16",
  "sources": [
    "hardware-corner-gpu-llm-benchmarks-q4k-context-sweep-2026"
  ]
}
