{
  "id": "llamacpp-metal-m4-max-32core-llama27b-q4-0-tg128-8e672ef",
  "type": "benchmark",
  "name": "llama.cpp Metal on M4 Max (32 GPU): Llama-2-7B gguf-q4-0 tg128 tok/s (scoreboard #4167, 8e672ef)",
  "engine_id": "llama-cpp",
  "accelerator_ids": [
    "apple-m4-max"
  ],
  "interconnect_ids": [],
  "model": "Llama-2-7B gguf-q4-0.gguf",
  "format_id": "gguf-q4-0",
  "metric": "decode_tok_s",
  "value": 43.87,
  "unit": "tok/s (tg128, batch 1, per-request)",
  "methodology": "COMMUNITY-SCOREBOARD (llama.cpp discussion #4167, ggerganov-maintained). llama-bench -hf ggml-org/Llama-2-7B-GGUF -p 512 -n 128 -ngl 99 --delay 30, Metal backend, full GPU offload. Build commit 8e672ef. pp512 = prefill at batch 512; tg128 = batch-1 decode. mean over default -r 5. Per-request, NOT aggregate. Chip: 32 GPU cores, 410 GB/s memory BW. This is the core-count bin the earlier ingest of this table did not file.",
  "measured_by": "third_party",
  "reproducible": true,
  "energy_basis": null,
  "power_w": null,
  "power_scope": null,
  "power_cap": null,
  "clock_lock_mhz": null,
  "thermal_state": null,
  "notes": "Maintainer-curated Apple Silicon llama-bench table (discussion #4167). Same Llama-2-7B weights and pp512/tg128 protocol as the other rows of that table. Lower-core bin of the same chip family, so it is not interchangeable with the higher-core row already stored.",
  "status": "verified",
  "confidence": 0.8,
  "updated": "2026-10-16",
  "sources": [
    "llama-cpp-discussion-4167-apple-silicon-llama-bench-table"
  ]
}
