{
  "id": "kyuz0-8060s-gemma-4-26b-a4b-it-ud-q8-k-xl-rocm723-64k-pp2048",
  "type": "benchmark",
  "name": "kyuz0 Strix Halo 8060S gemma-4-26B-A4B-it-UD-Q8_K_XL ROCm 7.2.3 64k pp2048",
  "engine_id": "llama-cpp",
  "accelerator_ids": [
    "amd-radeon-8060s-ryzen-ai-max"
  ],
  "interconnect_ids": [],
  "model": "gemma-4-26B-A4B-it-UD-Q8_K_XL",
  "format_id": null,
  "metric": "prefill_tok_s",
  "value": 471.81,
  "unit": "tok/s",
  "methodology": "kyuz0 amd-strix-halo-toolboxes llama-bench sweep (results.json generated 2026-05-18, Fedora 43 kernel 6.19.12-200, llama.cpp build 0253fb21f / b9187). ROCm 7.2.3, -fa 1 -ngl 99 --mmap 0. Long-context cell: context depth 65536 tokens, prompt processing of 2048 tokens. ONE request, batch size 1, so the number is per-request, not aggregate across concurrent requests. Mean of the repeated runs; std 3.32 tok/s. Model file 25.94 GiB, 25.23 B params, quant Q8_K_XL.",
  "measured_by": "third_party",
  "reproducible": true,
  "energy_basis": null,
  "power_w": null,
  "power_scope": null,
  "power_cap": null,
  "clock_lock_mhz": null,
  "thermal_state": null,
  "notes": "Not in the earlier kyuz0 filing, which covered only the default-context pp512/tg128 cells. Same results.json, the longctx32768 and longctx65536 rows.",
  "status": "verified",
  "confidence": 0.7,
  "updated": "2026-10-17",
  "sources": [
    "kyuz0-strix-halo-toolboxes-llamabench-results-json"
  ]
}
