{
  "id": "nm-1s4bggo-w7900-35b-rocm-q4km-2k9-pp",
  "type": "benchmark",
  "name": "W7900 llama.cpp ROCm: Qwen3.5-35B-A3B prefill at 2.9K prompt (u/neuromacmd)",
  "engine_id": "llama-cpp",
  "accelerator_ids": [
    "amd-radeon-pro-w7900"
  ],
  "interconnect_ids": [
    "pcie-gen4"
  ],
  "model": "Qwen3.5-35B-A3B (unsloth UD-Q4_K_M, 21 GB)",
  "format_id": "gguf-q4-k-m",
  "metric": "prefill_tok_s",
  "value": 1001,
  "unit": "tok/s (single-request prefill, ~2900 prompt tokens)",
  "methodology": "r/LocalLLaMA post 1s4bggo, EDIT 3. llama.cpp, the same unsloth GGUF files copied onto every machine, batch size 1, one request. Prompt processing column is labelled 'PP tok/s (2.9K)' so the prefill figure is for a ~2.9K-token prompt; generation is the decode rate of that single request, not an aggregate across concurrent requests. Fedora 43 host for the AMD cards (Ryzen 9 9900X, 192 GB DDR5-5600). Build for the AMD rows of this edit is the post's original llama.cpp (b8500 is named only for the Mac Metal run). Backend: ROCm. PREFILL of one request.",
  "measured_by": "third_party",
  "reproducible": true,
  "energy_basis": null,
  "power_w": null,
  "power_scope": null,
  "power_cap": null,
  "clock_lock_mhz": null,
  "thermal_state": null,
  "notes": "EDIT 3 of the post, ROCm backend, single GPU. The post's original table and this corrected same-GGUF table agree on these AMD cells. Per-request, batch 1.",
  "status": "verified",
  "confidence": 0.5,
  "updated": "2026-10-17",
  "sources": [
    "reddit-localllama-1s4bggo-amd-qwen35-llamacpp"
  ]
}
