{
  "id": "qwen-bench-h20-sglang-qwen3-0p6b-fp8-in30720-tps",
  "type": "benchmark",
  "name": "Qwen docs: Qwen3-0.6B FP8 on 1x H20 SGLang, input 30720, 3819.86 tok/s e2e",
  "engine_id": "sglang",
  "accelerator_ids": [
    "nvidia-h20"
  ],
  "interconnect_ids": [],
  "model": "Qwen3-0.6B",
  "format_id": "fp8-e4m3",
  "metric": "tps_aggregate",
  "value": 3819.86,
  "unit": "tok/s (batch-1 e2e, in=30720+2048gen)",
  "methodology": "VENDOR-MEASURED (Qwen team, qwen.readthedocs.io Speed Benchmark). SGLang 0.4.6.post1 + sgl-kernel 0.1.0, PyTorch 2.6.0+cu124, vLLM 0.7.2 for AWQ-marlin. NVIDIA H20 96GB, context_length=140000, enable_mixed_chunk, mem_fraction_static=0.85, skip_tokenizer_init. Batch size 1, minimum GPU count. Speed=(prompt+generated)/e2e time = end-to-end per-request throughput including prefill — NOT pure decode. Generate 2048 tokens. Config: 1x H20.",
  "measured_by": "vendor",
  "reproducible": true,
  "energy_basis": null,
  "power_w": null,
  "power_scope": null,
  "power_cap": null,
  "clock_lock_mhz": null,
  "thermal_state": null,
  "notes": "Metric is end-to-end (prompt+gen)/time on a single request — equivalent to ~decode rate only as input_len->0; at larger input lengths it blends prefill+decode. Reads LOWER than a pure tg number. Vendor page; H20 is the China-export Hopper (96GB HBM3, ~4.0 TB/s, 148 TFLOPS BF16).",
  "status": "verified",
  "confidence": 0.75,
  "updated": "2026-10-15",
  "sources": [
    "qwen-docs-h20-speed-benchmark"
  ]
}
