{
  "id": "hwcorner-rtx-3080-ti-qwen3-14b-q4kxl-decode-16k",
  "type": "benchmark",
  "name": "Hardware Corner: RTX 3080 Ti 12GB, llama.cpp CUDA, Qwen3 14B Q4_K_XL GGUF, decode 52.29 t/s @16k ctx",
  "engine_id": "llama-cpp",
  "accelerator_ids": [
    "nvidia-rtx-3080-ti"
  ],
  "interconnect_ids": [
    "pcie-gen4"
  ],
  "model": "Qwen3 14B Q4_K XL GGUF",
  "format_id": "gguf-q4-k-m",
  "metric": "decode_tok_s",
  "value": 52.29,
  "unit": "tok/s per-request decode (batch 1, ~16384-token context)",
  "methodology": "THIRD-PARTY MEASURED (hardware-corner.net Definitive GPU Ranking for LLMs, accessed 2026-10-15). llama.cpp llama-bench CUDA 12.8, Ubuntu 24.04, Q4_K_XL GGUF quants, decode tok/s per GPU per model at ~16K context. Per-request batch-1, NOT aggregate. Value is the 16K-context column.",
  "measured_by": "third_party",
  "reproducible": true,
  "energy_basis": null,
  "power_w": null,
  "power_scope": null,
  "power_cap": null,
  "clock_lock_mhz": null,
  "thermal_state": null,
  "notes": "Single-card row at 16K context; same table publishes 32K/65K/131K context columns.",
  "status": "verified",
  "confidence": 0.7,
  "updated": "2026-10-15",
  "sources": [
    "hardware-corner-gpu-ranking-local-llm"
  ]
}