{
  "id": "hwcorner-rtx-a6000-qwen3-8b-q4kxl-pp512-65k",
  "type": "benchmark",
  "name": "Hardware Corner: RTX A6000 48GB, llama.cpp CUDA, Qwen3 8B Q4_K XL GGUF, pp512 950.96 t/s @65k ctx",
  "engine_id": "llama-cpp",
  "accelerator_ids": [
    "nvidia-rtx-a6000"
  ],
  "interconnect_ids": [
    "pcie-gen4"
  ],
  "model": "Qwen3 8B Q4_K XL GGUF",
  "format_id": "gguf-q4-k-m",
  "metric": "prefill_tok_s",
  "value": 950.96,
  "unit": "tok/s per-request prompt processing pp512 (batch 1, ~65536-token context)",
  "methodology": "THIRD-PARTY MEASURED (hardware-corner.net Definitive GPU Ranking for LLMs, page updated 2025-12-09, accessed 2026-10-16). llama.cpp llama-bench on Ubuntu 24.04, CUDA 12.8, Q4_K_XL GGUF (nearest repo format gguf-q4-k-m), single GPU, full offload. Metric is per-request prompt-processing tok/s (pp512) measured with the context filled to ~65536 tokens (65k), batch 1, NOT aggregate. Value is the 65k column of the prompt-processing table for Qwen3 8B.",
  "measured_by": "third_party",
  "reproducible": true,
  "energy_basis": null,
  "power_w": null,
  "power_scope": null,
  "power_cap": null,
  "clock_lock_mhz": null,
  "thermal_state": null,
  "notes": "Single-GPU batch-1 row from the Hardware Corner in-lab ranking table. Q4_K_XL is their published quant label; filed under gguf-q4-k-m as the nearest schema format, same convention as the 16k rows already in this repo. Per-request, not an aggregate serving number. The page does not publish the exact llama.cpp commit hash for this table.",
  "status": "verified",
  "confidence": 0.7,
  "updated": "2026-10-16",
  "sources": [
    "hardware-corner-gpu-ranking-local-llm"
  ]
}
