{
  "id": "llamacpp-cuda-rtx-4070-ti-super-llama27b-q40-nofa-tg128",
  "type": "benchmark",
  "name": "llama.cpp CUDA on RTX 4070 Ti SUPER 16GB: Llama-2-7B Q4_0 FA-off tg128 decode tok/s",
  "status": "verified",
  "confidence": 0.75,
  "updated": "2026-10-16",
  "sources": [
    "llama-cpp-discussion-15013-nvidia-cuda-scoreboard"
  ],
  "engine_id": "llama-cpp",
  "accelerator_ids": [
    "nvidia-rtx-4070-ti-super"
  ],
  "interconnect_ids": [],
  "model": "llama-2-7b.Q4_0.gguf (TheBloke, 3.56 GiB, 6.74B params)",
  "format_id": "gguf-q4-0",
  "metric": "decode_tok_s",
  "value": 132.26,
  "unit": "tok/s (tg128, per-request, batch 1)",
  "methodology": "COMMUNITY-SCOREBOARD (llama.cpp discussion #15013, maintainer-curated CUDA backend). llama-bench llama-2-7b.Q4_0.gguf, ngl=99, -fa 0. RTX 4070 Ti SUPER 16GB. Build commit 9c35706, reporter @Ristovski. llama-bench default repeats, mean. Single device, per-request batch-1, NOT aggregate.",
  "measured_by": "third_party",
  "reproducible": true,
  "notes": "Paired with the other row from the same run. ",
  "energy_basis": null,
  "power_w": null,
  "power_scope": null,
  "power_cap": null,
  "clock_lock_mhz": null,
  "thermal_state": null
}
