{
  "id": "mlperf-v6-1-intel-2x6980p-llama31-8b-int8-server",
  "type": "benchmark",
  "name": "MLPerf v6.1 Intel 2x Xeon 6980P: llama3.1-8b INT8 Server aggregate tok/s",
  "status": "verified",
  "confidence": 0.8,
  "updated": "2026-10-17",
  "sources": [
    "mlperf-v6-1-summary-csv-xeon6-cpu"
  ],
  "engine_id": "vllm",
  "accelerator_ids": [
    "intel-xeon-6980p-granite-rapids"
  ],
  "interconnect_ids": [],
  "model": "llama3.1-8b",
  "format_id": "int8-w8a8",
  "metric": "tps_aggregate",
  "value": 1139.51,
  "unit": "tok/s AGGREGATE over 2x Xeon 6980P (Server scenario)",
  "methodology": "MLPerf Inference v6.1 closed division, CPU-only (summary.csv accelerator_model_name is N/A). Values copied from summary.csv, not from a per-system mlperf_log_summary.txt. AGGREGATE throughput for the whole node, NOT per-request decode and NOT per-socket. Prompt length, output length, and batch size are not in the summary row. weight_data_types INT8. Framework column is PyTorch. Scenario: Server. System: Intel 1-node-2S-GNR_128C. Same system as the Offline row. Server scenario is latency-constrained aggregate throughput, still not per-request decode. 1139.51 tok/s across two 128-core sockets. measured_by vendor: these are submitter results inside the MLCommons closed division (Intel, Dell, Supermicro, Quanta, Red Hat, Cisco), not an independent re-run.",
  "measured_by": "vendor",
  "reproducible": true,
  "energy_basis": null,
  "power_w": null,
  "power_scope": null,
  "power_cap": null,
  "clock_lock_mhz": null,
  "thermal_state": null,
  "notes": "Same system as the Offline row. Server scenario is latency-constrained aggregate throughput, still not per-request decode. 1139.51 tok/s across two 128-core sockets."
}
