{
  "id": "hwc26-rtx-3090-gptoss-20b-mxfp4-tg-4k",
  "type": "benchmark",
  "name": "Hardware Corner Mar-2026: nvidia-rtx-3090 llama.cpp gpt-oss-20B MXFP4 GGUF token generation 147.5 tok/s at 4k context",
  "engine_id": "llama-cpp",
  "accelerator_ids": [
    "nvidia-rtx-3090"
  ],
  "interconnect_ids": [
    "pcie-gen4"
  ],
  "model": "gpt-oss-20B MXFP4 GGUF",
  "format_id": "gguf-mxfp4-moe",
  "metric": "decode_tok_s",
  "value": 147.5,
  "unit": "tok/s per-request decode (batch 1, ~4096-token context tier)",
  "methodology": "THIRD-PARTY MEASURED (hardware-corner.net /gpu-llm-benchmarks/rtx-3090/, page updated March 2026, accessed 2026-10-16). llama.cpp llama-bench, GGUF, single GPU, full offload. The page publishes prompt-processing tok/s and token-generation tok/s by context tier; it does not state the llama.cpp build, the prompt length, or the generation length. The page annotates this model row CUDA, -fa 1 (flash attention on). Value is the 4k context column. Per-request batch-1, NOT aggregate across concurrent requests.",
  "measured_by": "third_party",
  "reproducible": true,
  "energy_basis": null,
  "power_w": null,
  "power_scope": null,
  "power_cap": null,
  "clock_lock_mhz": null,
  "thermal_state": null,
  "notes": "Context tier is the page bucket, not an exact measured token count. Page quant Q4_K maps to gguf-q4-k-m; page MXFP4 maps to gguf-mxfp4-moe. Distinct from the older Q4_K_XL rows sourced from hardware-corner-gpu-ranking-local-llm.",
  "status": "verified",
  "confidence": 0.62,
  "updated": "2026-10-16",
  "sources": [
    "hardware-corner-gpu-llm-benchmarks-q4k-context-sweep-2026"
  ]
}
