{
  "id": "comm-hailo10h-pi-ai-hat2-qwen25-coder-1p5b-tps",
  "type": "benchmark",
  "name": "Hailo-10H (Pi AI HAT+ 2) Qwen2.5-Coder-1.5B compiled-model TPS",
  "status": "verified",
  "confidence": 0.75,
  "updated": "2026-10-15",
  "sources": [
    "hailo-model-zoo-genai-models-rst-compiled-model-tps-table",
    "hailo-model-zoo-genai-models-rst-tps-table"
  ],
  "engine_id": "llama-cpp",
  "accelerator_ids": [
    "hailo-10h"
  ],
  "interconnect_ids": [],
  "model": "Qwen2.5-Coder-1.5B",
  "format_id": null,
  "metric": "decode_tok_s",
  "value": 8.13,
  "unit": "tokens/sec compiled-model TPS (Hailo-Ollama on HailoRT)",
  "methodology": "Vendor compiled-model TPS table (hailo_model_zoo_genai MODELS.rst); single-stream class figure, batch-1 Ollama-compatible server",
  "measured_by": "vendor",
  "reproducible": null,
  "energy_basis": null,
  "power_w": null,
  "power_scope": null,
  "power_cap": null,
  "clock_lock_mhz": null,
  "thermal_state": "unknown",
  "notes": "VENDOR COMPILED-MODEL TABLE. Ceiling is ~2B params - the HAT+2 cannot run 7B+."
}
