{
  "id": "argonne-a100sxm40-niche-deepspeed-mii-llama2-7b-fp16-2x-b1-128io-tps",
  "type": "benchmark",
  "name": "Argonne A100-SXM-40GB x2 Deepspeed-MII meta-llama/Llama-2-7b-hf b1",
  "status": "verified",
  "confidence": 0.75,
  "updated": "2026-10-15",
  "sources": [
    "argonne-llm-inference-bench-all-results-csv"
  ],
  "engine_id": "niche-deepspeed-mii",
  "accelerator_ids": [
    "nvidia-a100-40gb-sxm4"
  ],
  "interconnect_ids": [],
  "model": "meta-llama/Llama-2-7b-hf",
  "format_id": null,
  "metric": "tps_aggregate",
  "value": 151.24,
  "unit": "tok/s aggregate (batch*(in+out)/latency)",
  "methodology": "THIRD-PARTY MEASURED (Argonne LLM-Inference-Bench, arXiv:2411.00136, All_results.csv). Deepspeed-MII on NVIDIA A100 SXM 40GB x2, FP16/BF16, 128 in / 128 out, batch 1. Throughput = batch*(in+out)/latency = AGGREGATE across batch. Latency 1.69s.",
  "measured_by": "third_party",
  "reproducible": true,
  "energy_basis": null,
  "power_w": null,
  "power_scope": null,
  "power_cap": null,
  "clock_lock_mhz": null,
  "thermal_state": "unknown",
  "notes": "Argonne hardware matrix: A100 SXM 40GB x4/node. Framework=Deepspeed-MII."
}
