{
  "id": "argonne-mi300x-vllm-mistral-7b-fp16-b64-128io-tps",
  "type": "benchmark",
  "name": "Argonne MI300X vLLM Mistral-7B b64",
  "engine_id": "vllm",
  "accelerator_ids": [
    "amd-instinct-mi300x"
  ],
  "interconnect_ids": [],
  "model": "mistralai/Mistral-7B-v0.1",
  "format_id": null,
  "metric": "tps_aggregate",
  "value": 4348.4,
  "unit": "tok/s aggregate (batch*(in+out)/lat)",
  "methodology": "THIRD-PARTY MEASURED (Argonne LLM-Inference-Bench arXiv:2411.00136, All_results.csv). vLLM, FP16/BF16, 128in/128out, AGGREGATE over batch. 1x bs64 lat 3.77s. CSV 'AMD MI300X GPU' = 8x MI300X node (xGMI Infinity Fabric).",
  "measured_by": "third_party",
  "reproducible": true,
  "energy_basis": null,
  "power_w": null,
  "power_scope": null,
  "power_cap": null,
  "clock_lock_mhz": null,
  "thermal_state": null,
  "notes": "",
  "status": "verified",
  "confidence": 0.75,
  "updated": "2026-10-15",
  "sources": [
    "argonne-llm-inference-bench-all-results-csv"
  ]
}
