{
  "id": "lw-epyc9334-dual-deepseek8b-fp16-tg",
  "type": "benchmark",
  "name": "LeaseWeb amd-epyc-9334-genoa-dual DeepSeek-R1-0528-Qwen3-8B FP16 decode tok/s FP16",
  "status": "verified",
  "confidence": 0.65,
  "updated": "2026-10-15",
  "sources": [
    "leaseweb-amd-epyc-llm-inference-benchmark-cpu-vs-gpu"
  ],
  "engine_id": "llama-cpp",
  "accelerator_ids": [
    "amd-epyc-9334-genoa-dual"
  ],
  "interconnect_ids": [],
  "model": "DeepSeek-R1-0528-Qwen3-8B",
  "format_id": null,
  "metric": "decode_tok_s",
  "value": 8.1,
  "unit": "tok/s (decode, single-request)",
  "methodology": "LeaseWeb benchmark (HPE ProLiant DL385 Gen11, dual EPYC 9334 32C Zen4, 64GB DDR5; L4 reference single GPU). llama-bench + OpenLLM/llmperf. 512-token prompt, 128 generated, 24 CPU threads for LLM runs. decode tok/s FP16.",
  "measured_by": "third_party",
  "reproducible": true,
  "energy_basis": null,
  "power_w": null,
  "power_scope": null,
  "power_cap": null,
  "clock_lock_mhz": null,
  "thermal_state": "unknown",
  "notes": "Dual-socket EPYC 9334 (2x32C) unless L4. LLM at 24 threads."
}
