{
  "id": "comm-apple-m2-ultra-qwen3-235b-a22b-mlx-tg",
  "type": "benchmark",
  "name": "Mac Studio M2 Ultra Qwen3-235B-A22B 4-bit decode, MLX",
  "engine_id": "apple-mlx",
  "accelerator_ids": [
    "apple-m2-ultra"
  ],
  "interconnect_ids": [],
  "model": "Qwen3-235B-A22B",
  "format_id": null,
  "metric": "decode_tok_s",
  "value": 26.4,
  "unit": "tok/s",
  "methodology": "THIRD-PARTY MEASURED (Silicon Score table; MLX runtime on M2 Ultra unified memory). 4-bit quant, MoE - only ~22B active params read per token, which is why the big-MoE number far exceeds the ~9-11 t/s dense-70B estimate on the same ~800 GB/s part.",
  "measured_by": "third_party",
  "reproducible": true,
  "notes": "192GB config; the capacity play for 70B at 8-bit + long ctx or 235B-class MoE. Used ~$3,200-4,200 Oct-2026.",
  "status": "verified",
  "confidence": 0.7,
  "updated": "2026-10-15",
  "sources": [
    "siliconscore-benchmarks-json-apple-silicon"
  ]
}
