{
  "id": "llamacpp-scoreboard-rtx-2070-super-nofa-pp512",
  "type": "benchmark",
  "name": "llama.cpp CUDA RTX 2070 SUPER llama-2-7b Q4_0 pp512 noFA",
  "engine_id": "llama-cpp",
  "accelerator_ids": [
    "nvidia-rtx-2070-super"
  ],
  "interconnect_ids": [],
  "model": "llama-2-7b.Q4_0.gguf (ggml-org, 3.56 GiB, 6.74B params)",
  "format_id": "gguf-q4-0",
  "metric": "prefill_tok_s",
  "value": 2088.34,
  "unit": "tok/s (pp512)",
  "methodology": "COMMUNITY-SCOREBOARD (llama.cpp discussion #15013, maintainer-curated CUDA backend). llama-bench llama-2-7b.Q4_0.gguf (ggml-org, 3.56 GiB, 6.74B params), pp512 and tg128, n_gpu_layers 99, batch 1, full GPU offload, CUDA. Per-request batch-1, not an aggregate across concurrent requests. Flash attention off (-fa 0). Build bc07349, reporter @phstudy. Printed mean 2088.34. Re-read of the discussion page on 2026-10-17.",
  "measured_by": "third_party",
  "reproducible": true,
  "energy_basis": null,
  "power_w": null,
  "power_scope": null,
  "power_cap": null,
  "clock_lock_mhz": null,
  "thermal_state": null,
  "notes": "RTX 2070 SUPER, 8 GB / GDDR6 / 256 bit, build bc07349, reporter @phstudy. prompt processing cell.",
  "status": "verified",
  "confidence": 0.6,
  "updated": "2026-10-17",
  "sources": [
    "llama-cpp-discussion-15013-nvidia-cuda-scoreboard"
  ]
}
