{
  "id": "leaseweb-l4-deepseek8b-fp16-decode",
  "type": "benchmark",
  "name": "LeaseWeb: DeepSeek-R1-8B FP16 on NVIDIA L4, 16.7 tok/s decode",
  "engine_id": "llama-cpp",
  "accelerator_ids": [
    "nvidia-l4"
  ],
  "interconnect_ids": [],
  "model": "DeepSeek-R1-0528-Qwen3-8B FP16",
  "format_id": null,
  "metric": "decode_tok_s",
  "value": 16.7,
  "unit": "tok/s (batch-1 decode)",
  "methodology": "THIRD-PARTY MEASURED (LeaseWeb blog, same article/rig as the EPYC-9334 rows). NVIDIA L4 GPU, FP16 model, 512-token prompt + 128 generated. API-level OpenLLM/llmperf measurement.",
  "measured_by": "third_party",
  "reproducible": false,
  "energy_basis": null,
  "power_w": null,
  "power_scope": null,
  "power_cap": null,
  "clock_lock_mhz": null,
  "thermal_state": null,
  "notes": "Same-rig comparison row in the EPYC article; L4 ~2x the dual-socket CPU on FP16 dense.",
  "status": "verified",
  "confidence": 0.6,
  "updated": "2026-10-15",
  "sources": [
    "leaseweb-amd-epyc-llm-inference-benchmark-cpu-vs-gpu"
  ]
}
