{
  "type": "benchmark",
  "interconnect_ids": [],
  "reproducible": true,
  "energy_basis": null,
  "power_w": null,
  "power_scope": null,
  "power_cap": null,
  "clock_lock_mhz": null,
  "thermal_state": null,
  "notes": "",
  "status": "verified",
  "updated": "2026-10-16",
  "id": "hc26-6000ada-qwen3-30b-a3b-q4k-128k-pp",
  "name": "NVIDIA RTX 6000 Ada llama.cpp: Qwen3 30B A3B (Q4_K) prompt processing at 128k context",
  "engine_id": "llama-cpp",
  "accelerator_ids": [
    "nvidia-rtx-6000-ada"
  ],
  "model": "Qwen3 30B A3B (Q4_K)",
  "format_id": "gguf-q4-k-m",
  "metric": "prefill_tok_s",
  "value": 448.6,
  "unit": "tok/s (pp128k, per-request batch-1)",
  "methodology": "THIRD-PARTY MEASURED (Hardware Corner GPU LLM Benchmarks page, tables dated March 2026). llama.cpp llama-bench, GGUF, single GPU, batch-1. NVIDIA RTX 6000 Ada. Qwen3 30B A3B (Q4_K). Number is the 128k-context column of the Prompt Processing table: context depth the run was measured at, not a fixed pp512/tg128. Per-request, NOT aggregate.",
  "measured_by": "third_party",
  "confidence": 0.6,
  "sources": [
    "hardware-corner-gpu-llm-benchmarks-pages-2026-03"
  ]
}
