{
  "id": "hc26-3090-gemma4-26b-q4k-32k-tg",
  "type": "benchmark",
  "name": "NVIDIA RTX 3090 llama.cpp: Gemma4 26B (Q4_K) token generation at 32k context",
  "engine_id": "llama-cpp",
  "accelerator_ids": [
    "nvidia-rtx-3090"
  ],
  "interconnect_ids": [],
  "model": "Gemma4 26B (Q4_K)",
  "format_id": "gguf-q4-k-m",
  "metric": "decode_tok_s",
  "value": 107.5,
  "unit": "tok/s (tg32k, per-request batch-1)",
  "methodology": "THIRD-PARTY MEASURED (Hardware Corner GPU LLM Benchmarks page, tables dated March 2026). llama.cpp llama-bench, GGUF, single GPU, batch-1. NVIDIA RTX 3090. Gemma4 26B (Q4_K). Number is the 32k-context column of the Token Generation table: context depth the run was measured at, not a fixed pp512/tg128. Per-request, NOT aggregate. The 4k and deepest-context cells of this model were already filed; this is a missing intermediate context column.",
  "measured_by": "third_party",
  "reproducible": true,
  "energy_basis": null,
  "power_w": null,
  "power_scope": null,
  "power_cap": null,
  "clock_lock_mhz": null,
  "thermal_state": null,
  "notes": "Same page and protocol as the already-filed hc26-3090-gemma4-26b-q4k cells. Raw llama-bench logs are not published.",
  "status": "verified",
  "confidence": 0.6,
  "updated": "2026-10-18",
  "sources": [
    "hardware-corner-gpu-llm-benchmarks-pages-2026-03"
  ]
}
