{
  "id": "prob60dual-4x-mlperf-v5-1-llama2-70b-server-tokens",
  "type": "benchmark",
  "name": "Intel Arc Pro B60 24GB x4, MLPerf v5.1 Server: Llama-2-70B aggregate tok/s",
  "engine_id": "vllm",
  "accelerator_ids": [
    "intel-arc-pro-b60"
  ],
  "interconnect_ids": [
    "pcie-gen5"
  ],
  "model": "Llama-2-70B (FP8)",
  "format_id": null,
  "metric": "tps_aggregate",
  "value": 2110.05,
  "unit": "output tok/s AGGREGATE across 4x Arc Pro B60 (Server; ~528 tok/s per card)",
  "methodology": "VENDOR-MEASURED (MLPerf v5.1 closed submission, Intel). 4x Arc Pro B60 24GB GDDR6 (PCIe Gen5 x8) on Xeon 698X host, PyTorch vLLM, Llama-2-70B, Server. 'Tokens per second' = 2110.05 verbatim from mlperf_log_summary.txt. AGGREGATE across 4 cards — ~528/card.",
  "measured_by": "vendor",
  "reproducible": true,
  "energy_basis": null,
  "power_w": null,
  "power_scope": null,
  "power_cap": null,
  "clock_lock_mhz": null,
  "thermal_state": null,
  "notes": "Server scenario, TTFT ~161 ms min. 8 B60 dies, ~264 tok/s per die.",
  "status": "verified",
  "confidence": 0.8,
  "updated": "2026-10-14",
  "sources": [
    "bench-mlperf-v5-1-intel-4x-bmg-pro-b60"
  ]
}
